{
  "$schema": "https://json-schema.org/draft/2020-12/schema",
  "$id": "https://github.com/quantmind-br/model-loader/docs/profile-schema.json",
  "title": "model-loader Profile",
  "description": "JSON schema for a model-loader backend profile. Each profile is persisted as a single .json file under the configured profiles directory (default: ~/.config/model-loader/profiles/).",
  "type": "object",
  "required": ["schemaVersion", "id", "name", "model", "args", "launch", "meta", "pinned"],
  "properties": {
    "schemaVersion": {
      "type": "integer",
      "const": 3,
      "description": "Profile JSON schema version. Always 3 for the current format."
    },
    "id": {
      "type": "string",
      "minLength": 1,
      "pattern": "^[a-z0-9]+([._-][a-z0-9]+)*$",
      "description": "Unique filename-safe identifier for the profile. Used as the filename (id.json). Must be lowercase ASCII alphanumeric groups separated by single '.', '_', or '-'. Auto-generated from name via Slugify when not provided."
    },
    "name": {
      "type": "string",
      "minLength": 1,
      "description": "Human-readable profile name. Displayed in the TUI."
    },
    "description": {
      "type": "string",
      "description": "Optional free-text description of the profile."
    },
    "tags": {
      "type": "array",
      "description": "Optional list of string tags for filtering and grouping in the UI.",
      "items": { "type": "string" }
    },
    "model": {
      "type": "string",
      "minLength": 1,
      "description": "Absolute or relative path to the model file (typically a .gguf file for llama-server backends). Validated at runtime: file must exist on disk."
    },
    "args": {
      "type": "object",
      "description": "Structured backend command-line flags as key/value pairs. Each key is a flag name in canonical long form (e.g. 'ctx-size', 'flash-attn'). Values must match the type declared in the backend's FlagSchema (bool, int, float, or string). Note: due to JSON round-tripping, integer values may deserialize as float64; the validator accepts whole-number floats as integers. 'port' is reserved: it is assigned automatically by the process manager; if present in a profile it is ignored and stripped on load/save.",
      "additionalProperties": {
        "anyOf": [
          { "type": "boolean", "description": "FlagTypeBool: true/false flags (e.g. --flash-attn, --cont-batching)." },
          { "type": "integer", "description": "FlagTypeInt: whole numbers (e.g. ctx-size, n-gpu-layers)." },
          { "type": "number", "description": "FlagTypeFloat: floating-point values (e.g. temp, top-p, defrag-thold). Accepts both integers and floats." },
          { "type": "string", "description": "FlagTypeString: free-text values (e.g. cache-type-k, host). FlagTypeEnum values are also strings restricted to a fixed set validated against the backend schema's EnumValues." }
        ]
      }
    },
    "extraArgs": {
      "type": "array",
      "description": "Raw extra CLI arguments passed as-is to the backend binary. Each entry must start with '--'. Format: '--flag' or '--flag=value'. For non-bool flags without '=' the next array element is consumed as the value.",
      "items": {
        "type": "string",
        "pattern": "^--",
        "description": "Must start with '--'."
      }
    },
    "launch": {
      "type": "object",
      "required": ["defaultBackground", "restart_policy", "max_restarts", "backoff_seconds"],
      "description": "Launch configuration for this profile.",
      "properties": {
        "defaultBackground": {
          "type": "boolean",
          "description": "If true, the process starts in background mode by default when launched from the TUI."
        },
        "logFilePath": {
          "type": "string",
          "description": "Optional custom log file path for this profile's backend output. Falls back to global log directory if empty."
        },
        "backendId": {
          "type": "string",
          "description": "Optional ID of the backend (from the backend catalog) to use for launching this profile. If empty, the default backend from the catalog is used."
        },
        "env": {
          "type": "array",
          "description": "Optional environment variables applied to the backend process at launch. Keys must match [A-Za-z_][A-Za-z0-9_]*. Last value wins on duplicate keys.",
          "items": { "$ref": "#/$defs/envVar" }
        },
        "llamaServerBinaryPath": {
          "type": "string",
          "description": "LEGACY: read-only migration field. Not written after migration. Use the backend catalog instead."
        },
        "restart_policy": {
          "type": "string",
          "enum": ["", "none", "on-failure", "always"],
          "description": "Restart policy for the backend process. '' or 'none' = never restart, 'on-failure' = restart only on non-zero exit, 'always' = restart unconditionally. An empty string is treated as 'none'."
        },
        "max_restarts": {
          "type": "integer",
          "minimum": 0,
          "description": "Maximum number of restart attempts. Only applies when restart_policy is 'on-failure' or 'always'."
        },
        "backoff_seconds": {
          "type": "integer",
          "minimum": 0,
          "description": "Delay in seconds between restart attempts."
        }
      },
      "additionalProperties": false
    },
    "meta": {
      "type": "object",
      "required": ["createdAt", "updatedAt"],
      "description": "System-managed metadata. Populated automatically by the store on create/update.",
      "properties": {
        "createdAt": {
          "type": "string",
          "format": "date-time",
          "description": "ISO 8601 / RFC 3339 timestamp when the profile was first created."
        },
        "updatedAt": {
          "type": "string",
          "format": "date-time",
          "description": "ISO 8601 / RFC 3339 timestamp when the profile was last modified."
        },
        "lastUsedAt": {
          "type": ["string", "null"],
          "format": "date-time",
          "description": "Optional ISO 8601 timestamp of the most recent launch. Null or absent if never launched."
        }
      },
      "additionalProperties": false
    },
    "pinned": {
      "type": "boolean",
      "description": "If true, the profile is pinned to the top of the profile list in the TUI."
    }
  },
  "additionalProperties": false,

  "$defs": {
    "envVar": {
      "type": "object",
      "required": ["key", "value"],
      "description": "A single KEY=VALUE environment variable applied to the backend process at launch.",
      "properties": {
        "key": {
          "type": "string",
          "pattern": "^[A-Za-z_][A-Za-z0-9_]*$",
          "description": "Environment variable name. Must match [A-Za-z_][A-Za-z0-9_]*."
        },
        "value": {
          "type": "string",
          "description": "Environment variable value. Used literally (no shell expansion)."
        }
      },
      "additionalProperties": false
    },
    "flagTypeNote": {
      "description": "Flag value type semantics: boolean -> FlagTypeBool, integer -> FlagTypeInt, number -> FlagTypeFloat, string -> FlagTypeString or FlagTypeEnum. Enum flags are represented as strings restricted to a fixed set of values, validated against the backend schema's EnumValues."
    },
    "argsExample": {
      "type": "object",
      "description": "Example args block for a typical llama-server profile.",
      "examples": [
        {
          "batch-size": 2048,
          "ctx-size": 262144,
          "flash-attn": true,
          "host": "127.0.0.1",
          "n-gpu-layers": 99,
          "temp": 1.0,
          "cache-type-k": "q8_0"
        }
      ]
    },
    "extraArgsExample": {
      "type": "array",
      "description": "Example extraArgs demonstrating both inline-value and next-element value styles.",
      "examples": [
        ["--override-tensor", "model.layers.0.attention.q.weight=q4_0"]
      ]
    }
  }
}
